{
  "schemaVersion": "team-ai/v1",
  "artifactType": "work-context",
  "artifactId": "ctx-4101-v1",
  "generatedAt": "2026-10-22T04:45:37.873Z",
  "workItem": {
    "organization": "fabrikam-demo",
    "project": "TL Control Demo",
    "id": 4101,
    "revision": 12,
    "url": "https://dev.azure.com/fabrikam-demo/TL%20Control%20Demo/_workitems/edit/4101"
  },
  "parentWorkItem": null,
  "contextVersion": 1,
  "repositories": [
    {
      "repoId": "frontend",
      "role": "frontend",
      "baseRef": "main",
      "baseSha": "aaa111fe"
    },
    {
      "repoId": "backend",
      "role": "backend",
      "baseRef": "main",
      "baseSha": "bbb222be"
    }
  ],
  "summary": {
    "functionalGoal": "Alta de cliente con validación fiscal",
    "currentBehavior": "Ver análisis; no inventar comportamiento ausente.",
    "expectedBehavior": "Dado un CUIT válido, el sistema persiste el cliente y muestra confirmación."
  },
  "scope": {
    "included": [
      "Clientes / Alta",
      "Clientes",
      "#5101 BE: endpoint POST /clientes"
    ],
    "excluded": [
      "Cambios de SP",
      "Refactors no pedidos"
    ],
    "candidateFiles": []
  },
  "acceptanceCriteria": [
    {
      "id": "ac-4101",
      "text": "Dado un CUIT válido, el sistema persiste el cliente y muestra confirmación.",
      "evidenceIds": []
    }
  ],
  "contracts": [
    {
      "id": "ctr-api-clientes",
      "kind": "API",
      "version": "v1",
      "status": "CONFIRMED",
      "sourceEvidenceIds": [],
      "definition": {
        "inputs": [
          {
            "name": "cuit",
            "type": "string",
            "nullable": false,
            "meaning": "CUIT"
          }
        ],
        "outputs": [
          {
            "name": "id",
            "type": "string",
            "nullable": false,
            "meaning": "Id cliente"
          }
        ],
        "errors": [
          "400 CUIT inválido"
        ],
        "compatibilityNotes": "v1"
      }
    }
  ],
  "dependencies": [],
  "evidence": [
    {
      "id": "ev-desc-4101",
      "kind": "work-item",
      "source": "#4101#description",
      "classification": "CONFIRMED",
      "observedAt": "2026-10-22T04:45:37.873Z",
      "summary": "Descripción de #4101 Alta de cliente con validación fiscal: Permitir dar de alta un cliente persona jurídica con CUIT y validación AFIP."
    },
    {
      "id": "ev-ac-4101",
      "kind": "work-item",
      "source": "#4101#ac",
      "classification": "CONFIRMED",
      "observedAt": "2026-10-22T04:45:37.873Z",
      "summary": "AC de #4101: Dado un CUIT válido, el sistema persiste el cliente y muestra confirmación."
    },
    {
      "id": "ev-desc-5101",
      "kind": "work-item",
      "source": "#5101#description",
      "classification": "CONFIRMED",
      "observedAt": "2026-10-22T04:45:37.873Z",
      "summary": "Descripción de #5101 BE: endpoint POST /clientes: Validar DNI único en POST /clientes. Incluir ejemplo del request."
    }
  ],
  "gaps": [],
  "testPlan": [
    {
      "id": "t-func-1",
      "title": "Caso feliz",
      "kind": "functional",
      "steps": [
        "Preparar datos de fixture",
        "Ejecutar flujo"
      ],
      "command": ""
    }
  ],
  "assignedTo": null,
  "readiness": {
    "status": "READY",
    "reasons": [
      "Contexto mínimo cubierto."
    ]
  },
  "contextHash": "50764743df1f78363ff99d654d2086cfc304729d244ae83bf7eaa71109dac1c1"
}
